{
  "osc1_wave_morph": 0.2,
  "osc1_unison": 0.0,
  "osc1_detune_cents": 0.10000000149011612,
  "osc1_level": 0.699999988079071,
  "osc2_wave_morph": 0.65,
  "osc2_unison": 0.0,
  "osc2_detune_cents": 0.10000000149011612,
  "osc2_level": 0.6000000238418579,
  "osc2_semitone_offset": 0.55,
  "noise_level": 0.10000000149011612,
  "filter_cutoff": 0.4,
  "filter_resonance": 0.20000000298023224,
  "filter_env_amount": 0.7,
  "amp_attack": 0.10000000149011612,
  "amp_decay": 0.20000000298023224,
  "amp_sustain": 0.800000011920929,
  "amp_release": 0.30000001192092896,
  "mod_attack": 0.05000000074505806,
  "mod_decay": 0.20000000298023224,
  "mod_sustain": 0.5,
  "mod_release": 0.30000001192092896,
  "lfo_rate": 0.20000000298023224,
  "lfo_amount": 0.20000000298023224,
  "lfo_target": 0.3,
  "master_volume": 0.699999988079071
}